first_identifier,first_sku,first_name,first_url,first_website_id,second_identifier,second_sku,second_name,second_url,second_website_id,accepted,delisted,score
46301,46301,Blueair Blue Pure Rep Filter for 221,http://www.lakeland.co.uk/46301/,944,5794809-new,689122010199,Blueair Blue Pure 221 Particle + Carbon Filter,https://www.argos.co.uk/product/5794809,1271,1,0,
24761,24761,JJ Intelligent Waste 50pk 4L CompostPack,http://www.lakeland.co.uk/24761/,944,7503775,5028420300079,Joseph Joseph Intelligent Waste Caddy Liners - 50 Pack,https://www.argos.co.uk/product/8527145,1271,1,1,
31956,31956,KitchenAid Artisan Stand Mixer Red 175,http://www.lakeland.co.uk/31956/,944,9163302-new,5413184120696,KitchenAid 5KSM175PSBER Artisan Stand Mixer - Red,https://www.argos.co.uk/product/9163302,1271,1,0,
73377,73377,Zero Water 4 Pack Filters,http://www.lakeland.co.uk/73377/,944,7605415-new,188781000065,Zerowater Replacement Water Filter - 4 Pack,http://www.argos.co.uk/product/7605415,1271,1,1,77
24588,24588,SIMPLEHUMAN STEEL FRAME DISHRACK,http://www.lakeland.co.uk/24588/,944,1466849,838810013916,simplehuman Steel Frame Dish Rack,https://www.argos.co.uk/product/2720072,1271,1,0,
72979,72979,PRESTIGE 20CM MULTI STEAMER,http://www.lakeland.co.uk/72979/,944,1905173,5000263771216,Prestige 20cm Multi Steamer,http://www.argos.co.uk/product/1905173,1271,1,1,
19555,19555,KitchenAid 9 Speed Hand Mixer Cream,http://www.lakeland.co.uk/19555/,944,7393480-new,5413184160333,KitchenAid 5KHM9212BER Hand Mixer - Almond Cream,https://www.argos.co.uk/product/7393480,1271,1,1,
26151,26151,Velvety Soft Throw Teal,http://www.lakeland.co.uk/26151/,944,7395189-new,5053146164490,Relaxwell by Dreamland Heated Throw - Teal,https://www.argos.co.uk/product/9050109,1271,1,0,88
25922,25922,TOUCH BIN 30L MATT BLACK,http://www.lakeland.co.uk/25922/,944,4049438-new,8710755418808,Brabantia 30 Litre Touch Lid Kitchen Bin - Matt Black,http://www.argos.co.uk/product/4049438,1271,1,1,96
24579,24579,SH Mini Sensor Magnifying Mirror,http://www.lakeland.co.uk/24579/,944,7430738-new,838810016535,simplehuman Illuminated Mini Sensor Mirror - Stainless Steel,https://www.argos.co.uk/product/7430738,1271,1,1,
25635,25635,SH DUAL MAGNIFICATION SENSOR MIRROR,http://www.lakeland.co.uk/25635/,944,8338080-new,838810018041,simplehuman Sensor Pro Mirror,https://www.argos.co.uk/product/8338080,1271,1,1,79
25823,25823,PULL OUT CAN SINGLE,http://www.lakeland.co.uk/25823/,944,1574573,838810001760,simplehuman 30 Litre Pull-Out Kitchen Bin - Black,https://www.argos.co.uk/product/1574573,1271,1,1,79
25364,25364,SIMPLEHUMAN SIZE F BIN LINERS,http://www.lakeland.co.uk/25364/,944,4759326,838810017778,simplehuman Bin Liner Code F 3 x 20 Pack 60 Liners.,http://www.argos.co.uk/static/Product/partNumber/4759326.htm,1271,1,1,
25735,25735,Joseph Joseph Toilet Brush Caddy Blue,http://www.lakeland.co.uk/25735/,944,8042998-new,5028420705072,Joseph Joseph Flex Plus Toilet Brush & Toilet Brush Holder,https://www.argos.co.uk/product/8042998,1271,1,1,76
25734,25734,Joseph Joseph Toilet Brush Blue,http://www.lakeland.co.uk/25734/,944,7981933-new,5028420705065,Joseph Joseph Smart Toilet Brush - White & Blue,https://www.argos.co.uk/product/7981933,1271,1,1,75
31818,31818,Delonghi Dedica Black,http://www.lakeland.co.uk/31818/,944,3928873,8004399328075,De'Longhi EC6808 Dedica Espresso Coffee Machine - Black,http://www.argos.co.uk/product/3928873,1271,1,1,
31932,31932,KitchenAid Food Processor 2.1L Cream,http://www.lakeland.co.uk/31932/,944,7525375-new,5413184603427,KitchenAid 5KFP0919BAC 2.1L Food Processor - Cream,https://www.argos.co.uk/product/7525375,1271,1,0,95
19553,19553,KitchenAid 9 Speed Hand Mixer Red,http://www.lakeland.co.uk/19553/,944,7306020-new,5413184160333,KitchenAid 5KHM9212BER Electric Hand Mixer - Empire Red,https://www.argos.co.uk/product/8955360,1271,1,0,88
31584,31584,Tefal OleoClean Pro,http://www.lakeland.co.uk/31584/,944,7006533,3045386375066,Tefal FR804040 Oleoclean Professional Fryer,http://www.argos.co.uk/product/7006533,1271,1,1,
26140,26140,NEWICON PEDAL BIN 12L ALMOND,http://www.lakeland.co.uk/26140/,944,6838348-new,8710755113901,Brabantia newIcon 20 Litre Pedal Bin - Almond,https://www.argos.co.uk/product/8528591,1271,1,1,71
19065,19065,Neon Pink Bobble Water Bottle,http://www.lakeland.co.uk/19065/,944,3919428,814547021721,Bobble 550ml Carry Cap - Neon Pink.,http://www.argos.co.uk/static/Product/partNumber/3919428.htm,1271,1,1,
24735,24735,SIMPLEHUMAN 46L RECTANGULAR RECYCLER,http://www.lakeland.co.uk/24735/,944,1466399,838810006826,simplehuman 46L Fingerprint Proof Rectangular Recycle Bin,http://www.argos.co.uk/product/1466399,1271,1,1,94
71086,71086,Gourmet Triple Slow Cooker & Warming Sta,http://www.lakeland.co.uk/71086/,944,4112358,5020260122729,Bella Triple Slow Cooker and Warming Station,http://www.argos.co.uk/product/4112358,1271,1,1,
70093,70093,Sage The Control Grip All in One,http://www.lakeland.co.uk/70093/,944,7964510-new,9312432021128,Sage BSB530UK The Control Grip All in One Hand Mixer - White,https://www.argos.co.uk/product/7964510,1271,1,1,86
53220,53220,Tefal IXEO All in One Ironing Solution,http://www.lakeland.co.uk/53220/,944,8659288-new,3121041020301,Tefal Ixeo QT1020 All in One Steam Station,https://www.argos.co.uk/product/8659288,1271,1,1,84
31894,31894,Nespresso VertuoPlus Black Machine,http://www.lakeland.co.uk/31894/,944,7593046-new,5018399113855,Nespresso by Magimix Vertuo Plus Pod Coffee Machine - Black,https://www.argos.co.uk/product/7593046,1271,1,1,75
31614,31614,Magimix Nespresso Citiz & Milk White,http://www.lakeland.co.uk/31614/,944,5653122,5018399113190,Nespresso by Magimix CitiZ Milk Coffee Machine 11319 - White,https://www.argos.co.uk/product/5653122,1271,1,1,
61578,61578,Grass Bunny,http://www.lakeland.co.uk/61578/,944,2027108-new,,Moss Bunny,https://www.argos.co.uk/product/2027108,1271,0,1,70
61580,61580,Easter White Tree,http://www.lakeland.co.uk/61580/,944,4383778-new,5059318225853,White Easter Tree,https://www.argos.co.uk/product/4383778,1271,0,1,98
31958,31958,KitchenAid Artisan Stand Mixer Black 175,http://www.lakeland.co.uk/31958/,944,8898111-new,5413184120665,KitchenAid 5KSM175PSBOB Artisan Stand Mixer - Black,https://www.argos.co.uk/product/8898111,1271,1,0,91
25232,25232,ROTARY TOP SPINNER 50M,http://www.lakeland.co.uk/25232/,944,4504595,8710755311321,Brabantia 50m 4 Arm Lift-O-Matic Washing Line & Accessories,https://www.argos.co.uk/product/4504595,1271,1,0,85
31707,31707,KitchenAid Stand Mixer Pasta Set,http://www.lakeland.co.uk/31707/,944,8860242-new,5413184400019,KitchenAid 5KSMPRA Pasta Sheet Roller and Cutter - S/Steel,https://www.argos.co.uk/product/8860242,1271,1,0,
26145,26145,LAUNDRY BIN 55L STEEL & GREY,http://www.lakeland.co.uk/26145/,944,5162266-new,8710755105029,Brabantia 55 Litre Laundry Bin Selector - Matt Steel,https://www.argos.co.uk/product/5162266,1271,1,1,89
26147,26147,BRABANTIA IRONING BOARD C TROPICAL LEAVE,http://www.lakeland.co.uk/26147/,944,8195278-new,8710755118463,Brabantia 124cm x 45cm Ironing Board - Tropical Leaves,https://www.argos.co.uk/product/8195278,1271,1,1,
25616,25616,Simplehuman Over Door Shower Caddy,http://www.lakeland.co.uk/25616/,944,7430910-new,838810018775,simplehuman Aluminium Over Door Shower Caddy,https://www.argos.co.uk/product/7430910,1271,1,1,
25321,25321,SH WALL MOUNT SENSOR MIRROR,http://www.lakeland.co.uk/25321/,944,4253097,838810015781,simplehuman Rechargeable Sensor Wall Mirror,http://www.argos.co.uk/product/4253097,1271,1,1,92
24930,24930,SH 40L PLASTIC SLIM STEP CAN STONE,http://www.lakeland.co.uk/24930/,944,2557520,838810012797,simplehuman 40 Litre Slim Pedal Bin - White,http://www.argos.co.uk/product/2557520,1271,1,1,
24933,24933,BRABANTIA TOUCH BIN 60L MATT BLACK,http://www.lakeland.co.uk/24933/,944,4086350,8710755108341,Brabantia 60 Litre Touch Lid Kitchen Bin - Matt Black,https://www.argos.co.uk/product/4086350,1271,1,1,100
70535,70535,Sage The Duo Temp Pro,http://www.lakeland.co.uk/70535/,944,7964534-new,9312432022873,Sage BES810BSS The Duo Temp Pro Espresso Coffee Machine,https://www.argos.co.uk/product/7964534,1271,1,0,
25731,25731,Joseph Joseph Soap Dispenser,http://www.lakeland.co.uk/25731/,944,8061302-new,5028420705034,Joseph Joseph Soap Dispenser - White & Blue,https://www.argos.co.uk/product/8061302,1271,1,1,88
70786,70786,Magimix 4200XL Food Processor,http://www.lakeland.co.uk/70786/,944,8891950-new,5018399184701,Magimix 4200XL Food Processor - White,https://www.argos.co.uk/product/8891950,1271,1,1,91
25003,25003,NiteSafe Dual Function Nightlight,http://www.lakeland.co.uk/25003/,944,5194492,5060195207337,Xtralite Nitesafe Dual Sensor Dusk to Dawn Light - White.,http://www.argos.co.uk/static/Product/partNumber/5194492.htm,1271,1,1,76
24612,24612,BRABANTIA PEDAL BIN MOTION CONTROL 20L,http://www.lakeland.co.uk/24612/,944,4088729,8710755106040,Brabantia 20 Litre Pedal Bin - Metallic Mint,http://www.argos.co.uk/product/4088729,1271,1,1,93
24952,24952,dyson v6 animal cordless vacuum,http://www.lakeland.co.uk/24952/,944,3807585,5025155021170,Dyson V6 Animal Cordless Handstick Vacuum Cleaner,https://www.argos.co.uk/product/3807585,1271,1,1,89
18479,18479,BLUE VINTAGE BREAD BIN,http://www.lakeland.co.uk/18479/,944,3054307,5010853196039,Typhoon Vintage Kitchen Blue Bread Bin,http://www.argos.co.uk/product/3054307,1271,1,1,86
18478,18478,BLUE VINTAGE CAKE TIN,http://www.lakeland.co.uk/18478/,944,3046762,5010853196022,Typhoon Vintage Kitchen Cake Tin - Blue,http://www.argos.co.uk/product/3046762,1271,1,1,86
71192,71192,Crock-Pot 5.7 Litre Autostir Slow Cooker,http://www.lakeland.co.uk/71192/,944,4122850,5011773057493,Crock-Pot 5.7L Autostir Slow Cooker - Stainless Steel,http://www.argos.co.uk/product/4122850,1271,1,1,97
24840,24840,Tefal Effectis Plus Steam Gen Iron,http://www.lakeland.co.uk/24840/,944,3220210,3121040053256,Tefal Effectis GV6760 Pressurised Steam Generator Iron,http://www.argos.co.uk/product/3220210,1271,1,1,89
18474,18474,BLUE VINTAGE COMPOST CADDY,http://www.lakeland.co.uk/18474/,944,3054699,5010853195988,Typhoon Vintage Compost Caddy - Blue,http://www.argos.co.uk/product/3054699,1271,1,1,
45505,45505,Corelle 12 Piece White Dinner Set,http://www.lakeland.co.uk/45505/,944,5764712,71160081956,Corelle Livingware 12 Piece Dinner Set - Winter Frost White,http://www.argos.co.uk/product/5764712,1271,1,1,
25370,25370,dyson v8 absolute cordless vacuum,http://www.lakeland.co.uk/25370/,944,5741388,5025155024294,Dyson V8 Absolute Cordless Handstick Vacuum Cleaner,https://www.argos.co.uk/product/5741388,1271,1,1,100
31723,31723,Magimix Le Glacier,http://www.lakeland.co.uk/31723/,944,4229227,5018399110472,Magimix 1.1 Le Glacier Ice Cream Maker 11047,https://www.argos.co.uk/product/4229227,1271,1,0,78
24951,24951,dyson v6 cordless vacuum,http://www.lakeland.co.uk/24951/,944,3828533,5025155021316,Dyson V6 Cordless Handstick Vacuum Cleaner,http://www.argos.co.uk/product/3828533,1271,1,1,87
16547,16547,Mason Cash Heritage 30cm Mixing Bowl,http://www.lakeland.co.uk/16547/,944,4279291,5010853219844,Mason Cash Baker Lane 29cm Mixing Bowl,http://www.argos.co.uk/product/4279291,1271,1,1,88
18460,18460,MC 21CM GREEN HEDGEHOG MIXING BOWL,http://www.lakeland.co.uk/18460/,944,1427314,5010853197852,Mason Cash Hedgehog 21cm Stoneware Mixing Bowl,http://www.argos.co.uk/product/1427314,1271,1,1,86
71566,71566,TYPHOON SKANDI SQUARE DISH SMALL,http://www.lakeland.co.uk/71566/,944,3808058,5010853220864,Typhoon Skandi Small 21.7cm Square Cast Iron Oven Dish,http://www.argos.co.uk/product/3808058,1271,1,1,96
24401,24401,SH RECTANGULAR RECYCLER,http://www.lakeland.co.uk/24401/,944,1459265,838810016313,simplehuman 46 Litre Rectangular Recycle Bin,https://www.argos.co.uk/product/1459265,1271,1,1,77
18477,18477,BLUE VINTAGE LARGE STORAGE CANISTER,http://www.lakeland.co.uk/18477/,944,3056721,5010853196015,Typhoon Vintage Kitchen Large Storage Canister - Blue,http://www.argos.co.uk/product/3056721,1271,1,1,94
45165,45165,TYPHOON SEASONINGS OIL INFUSER,http://www.lakeland.co.uk/45165/,944,3791323,5010853220796,Typhoon Seasonings Oil Infuser,http://www.argos.co.uk/product/3791323,1271,1,1,97
24398,24398,SH SEMI ROUND SENSOR CAN PLASTIC LID,http://www.lakeland.co.uk/24398/,944,1378645,838810015620,simplehuman 45L Semi Round Sensor Bin - Silver,http://www.argos.co.uk/product/1378645,1271,1,1,84
25369,25369,dyson v8 animal cordless vacuum,http://www.lakeland.co.uk/25369/,944,5427750,5025155024287,Dyson V8 Animal Cordless Stick Vacuum Cleaner,https://www.argos.co.uk/product/5427750,1271,1,0,96
19362,19362,Pyrex Glass Oven Tray,http://www.lakeland.co.uk/19362/,944,2678784,5010762010761,Pyrex 32x26cm Glass Baking Tray,http://www.argos.co.uk/product/2678784,1271,1,1,
15914,15914,3 FoodSaver Canisters,http://www.lakeland.co.uk/15914/,944,1082649,5060134331543,FoodSaver Storage Canisters - Set of 3,http://www.argos.co.uk/product/1082649,1271,1,1,
44917,44917,Typhoon Chalkboard & Tablet holder,http://www.lakeland.co.uk/44917/,944,3938904,5010853221144,Typhoon Vintage Chalkboard and Tablet Stand,http://www.argos.co.uk/product/3938904,1271,1,1,83
71310,71310,kMix White Blender,http://www.lakeland.co.uk/71310/,944,4367598,5011423125985,Kenwood Kmix BLX50 Blender - White,http://www.argos.co.uk/product/4367598,1271,1,1,93
70971,70971,Morphy Richards Prism Jug Kettle,http://www.lakeland.co.uk/70971/,944,4643047,5011832050267,Morphy Richards 108252 Prism Jug Kettle - White,http://www.argos.co.uk/product/4643047,1271,1,1,
24936,24936,BRABANTIA TOUCH BIN 30L METALLIC GREY,http://www.lakeland.co.uk/24936/,944,4044457,8710755391163,Brabantia 30 Litre Touch Lid Bin - Metallic Grey,http://www.argos.co.uk/product/4044457,1271,1,1,98
19087,19087,6LT HIGH DOME PRESSURE COOKER,http://www.lakeland.co.uk/19087/,944,8610351,5000263512574,Prestige 6 Litre High Dome Aluminium Pressure Cooker,http://www.argos.co.uk/product/8610351,1271,1,1,75
19364,19364,Pyrex Oval Glass Roaster and Rack,http://www.lakeland.co.uk/19364/,944,8434180,3426470006958,Pyrex Glass Easy Grip Oval Roaster - 42cm x 30cm.,http://www.argos.co.uk/static/Product/partNumber/8434180.htm,1271,1,1,
72203,72203,Brita 2.4L Elemaris Water Filter Jug,http://www.lakeland.co.uk/72203/,944,7495027,4006387076498,Brita Elemaris Meter XL Water Filter Jug - Black,https://www.argos.co.uk/product/7495027,1271,1,0,
70085,70085,Kenwood True Tri Blade Hand Blender,http://www.lakeland.co.uk/70085/,944,1619713,5011423158358,Kenwood HB681 Triblade Hand Blender - White.,http://www.argos.co.uk/static/Product/partNumber/1619713.htm,1271,1,1,88
19748,19748,Sodastream Source Machine,http://www.lakeland.co.uk/19748/,944,4022778,8718309255091,SodaStream Source - Black,http://www.argos.co.uk/product/4022778,1271,1,1,90
25347,25347,Tefal Smart Protect Iron,http://www.lakeland.co.uk/25347/,944,5263969,3121040060032,Tefal FV4970 Smart Protect Steam Iron,http://www.argos.co.uk/product/5263969,1271,1,1,96
71315,71315,Kenwood Chef Sense Pink,http://www.lakeland.co.uk/71315/,944,5195288,5011423188263,Kenwood Chef Sense Stand Mixer - Pink,http://www.argos.co.uk/product/5195288,1271,1,1,
70797,70797,Nutritab Scale,http://www.lakeland.co.uk/70797/,944,4968942,309570133579,Nutritab Connected Kitchen Scale,http://www.argos.co.uk/product/4968942,1271,1,1,77
23847,23847,Gtech AirRam,http://www.lakeland.co.uk/23847/,944,4069614,5060060221345,Gtech AR02 AirRam Filter Bagless Upright Vacuum Cleaner,http://www.argos.co.uk/product/4069614,1271,1,1,80
16227,16227,3 Kilner Preserving Jars 500ml,http://www.lakeland.co.uk/16227/,944,4343897,5010853172767,Kilner 0.5 Litre Preserve Jars - Set of 3,http://www.argos.co.uk/product/4343897,1271,1,1,
71567,71567,TYPHOON SKANDI MINI CASSEROLE,http://www.lakeland.co.uk/71567/,944,3824362,5010853220871,Typhoon Skandi Mini Casserole Dish with Lid,http://www.argos.co.uk/product/3824362,1271,1,1,77
23438,23438,Shark 2 in 1 Electronic Steam Mop,http://www.lakeland.co.uk/23438/,944,4069078,5020044810613,Shark Lift-Away 2 in 1 Steam Pocket Mop S3901,http://www.argos.co.uk/product/4069078,1271,1,1,87
24841,24841,Tefal Pro Express Total X-pert Steam Gen,http://www.lakeland.co.uk/24841/,944,2038829,3121040048986,Tefal Pro Express X-Pert Pressurised Steam Generator.,http://www.argos.co.uk/static/Product/partNumber/2038829.htm,1271,1,1,93
19519,19519,IMPRIMA SCALLOP CANISTER,http://www.lakeland.co.uk/19519/,944,3042292,501085320400,Typhoon Imprima Large Storage Holder - Scallop,http://www.argos.co.uk/product/3042292,1271,1,1,80
25558,25558,TOUCH BIN NEXT RECYCLE 10 + 23L,http://www.lakeland.co.uk/25558/,944,6788979,8710755115004,Brabantia Touch Top Recycling Bin - Brilliant Steel,http://www.argos.co.uk/product/6788979,1271,1,1,79
25244,25244,TOUCH BIN 30L RED,http://www.lakeland.co.uk/25244/,944,4022400,8710755484148,Brabantia 30 Litre Touch Lid Kitchen Bin - Passion Red,http://www.argos.co.uk/product/4022400,1271,1,1,97
71559,71559,TYPHOON VISION SCALE BLUE,http://www.lakeland.co.uk/71559/,944,3927953,5010853220925,Typhoon Vision Electronic Scales - Blue,http://www.argos.co.uk/product/3927953,1271,1,1,94
71309,71309,Delonghi Espresso Maker,http://www.lakeland.co.uk/71309/,944,2144153,8004399325340,De'Longhi EC820 Espresso Machine - Black,http://www.argos.co.uk/product/2144153,1271,1,1,
17383,17383,"14"" NON STICK SIGNATURE WOK M/O",http://www.lakeland.co.uk/17383/,944,2662257,5010853204192,Typhoon 30cm Non-Stick Carbon Steel Signature Wok,http://www.argos.co.uk/product/2662257,1271,1,1,87
70335,70335,Krups Nespresso Inissia White Bundle,http://www.lakeland.co.uk/70335/,944,4271419,0010942217503,Nespresso Inissia & Aeroccino 3 Coffee Machine - White,https://www.argos.co.uk/product/4271419,1271,1,1,
31607,31607,Tefal Maison 1.7L Kettle Oatmeal Grey,http://www.lakeland.co.uk/31607/,944,5553923,3045386374311,Tefal Maison Stainless Steel Kettle - Oatmeal Grey,http://www.argos.co.uk/product/5553923,1271,1,1,88
24205,24205,4 Packmate Anti Mould Travel Bag Set,http://www.lakeland.co.uk/24205/,944,4557463,5060055131376,Packmate 4 Piece Travel Storage Bag Set.,http://www.argos.co.uk/static/Product/partNumber/4557463.htm,1271,1,1,73
71026,71026,Nutri Ninja,http://www.lakeland.co.uk/71026/,944,3796586,622356214674,Nutri Ninja BL450 Blender with Pulse Technology - Silver,http://www.argos.co.uk/product/3796586,1271,1,1,
24611,24611,BRABANTIA FLAT BK BIN 40L MOTION CONTROL,http://www.lakeland.co.uk/24611/,944,7392694-new,8710755482021,Brabantia 40 Litre Flat Back Pedal Bin - Matt Steel,https://www.argos.co.uk/product/8526847,1271,1,1,87
71565,71565,TYPHOON SKANDI OVAL GRATIN,http://www.lakeland.co.uk/71565/,944,3825505,5010853220857,Typhoon Skandi Small Oval Gratin Dish,http://www.argos.co.uk/product/3825505,1271,1,1,83
70333,70333,FoodSaver Vacuum Sealer with Roll Storag,http://www.lakeland.co.uk/70333/,944,3257393,5011773055055,FoodSaver Vacuum Storage - Black,http://www.argos.co.uk/static/Product/partNumber/3257393.htm,1271,1,1,85
31609,31609,Tefal Maison 4 Slice Toaster Oatmeal Gry,http://www.lakeland.co.uk/31609/,944,5536658,3045385783473,Tefal Maison 4 Slice Toaster - Grey,http://www.argos.co.uk/product/5536658,1271,1,1,92
70667,70667,Magic Bullet,http://www.lakeland.co.uk/70667/,944,4558747,5060385821411,Magic Bullet Deluxe,http://www.argos.co.uk/product/4558747,1271,1,1,
70969,70969,Morphy Richards Foldable Stand Mixer,http://www.lakeland.co.uk/70969/,944,4445472,5011832050236,Morphy Richards Total Control Folding Stand Mixer - White,http://www.argos.co.uk/product/4445472,1271,1,1,
23361,23361,Ecocharge Rechargeable Floor Sweeper,http://www.lakeland.co.uk/23361/,944,8550435,5060060221260,Gtech SW20 Premium Cordless Power Floor Sweeper,http://www.argos.co.uk/product/8550435,1271,1,1,81
71570,71570,TYPHOON SEASONINGS PESTLE & MORTAR,http://www.lakeland.co.uk/71570/,944,3915130,5010853220970,Typhoon Seasonings Pestle and Mortar,http://www.argos.co.uk/product/3915130,1271,1,1,90
24953,24953,dyson v6 absolute cordless vacuum,http://www.lakeland.co.uk/24953/,944,3859375,5025155020746,Dyson V6 Absolute Cordless Handstick Vacuum Cleaner,http://www.argos.co.uk/product/3859375,1271,1,1,91
24615,24615,BRABANTIA PEDAL BIN MOTION CONTROL 20L,http://www.lakeland.co.uk/24615/,944,4021652,8710755106026,Brabantia 20 Litre Pedal Bin - Passion Red,http://www.argos.co.uk/product/4021652,1271,1,1,
19528,19528,Steama,http://www.lakeland.co.uk/19528/,944,1452640,5020260121319,Steama by Sensiohome Food Steamer - Grey,http://www.argos.co.uk/product/1452640,1271,1,1,
71563,71563,TYPHOON SKANDI 16CM SAUCEPAN,http://www.lakeland.co.uk/71563/,944,3928639,5010853220833,Typhoon Skandi 16cm Saucepan with Lid,http://www.argos.co.uk/product/3928639,1271,1,1,90
70668,70668,Delonghi Nespresso Lattissima Touch Red,http://www.lakeland.co.uk/70668/,944,4175340,8004399325531,Nespresso Lattissima+ Coffee Machine by De'Longhi - Red,http://www.argos.co.uk/product/4175340,1271,1,1,
19324,19324,Mason Cash 26cm Yellow Mixing Bowl,http://www.lakeland.co.uk/19324/,944,1413359,5010853197838,Mason Cash Owl 26cm Stoneware Mixing Bowl,http://www.argos.co.uk/product/1413359,1271,1,1,96
31618,31618,KitchenAid Mini Stand Mixer Matte Black,http://www.lakeland.co.uk/31618/,944,6987093,5413184202729,KitchenAid 5K45SSBOB Classic Stand Mixer - Black,https://www.argos.co.uk/product/6987093,1271,1,0,89
24934,24934,BRABANTIA TOUCH BIN 60L BRILLIANT STEEL,http://www.lakeland.co.uk/24934/,944,3824850,8710755402586,Brabantia 60L Touch Top Bin - Black and Silver,http://www.argos.co.uk/product/3824850,1271,1,1,
24945,24945,BRABANTIA FLIP BIN 30L PASSION RED,http://www.lakeland.co.uk/24945/,944,4115128,8710755106903,Brabantia 30L Plastic Flip Bin Lid - Passion Red,http://www.argos.co.uk/product/4115128,1271,1,1,97
70702,70702,Salter Target Scale,http://www.lakeland.co.uk/70702/,944,3924169,5010777138214,Salter Target Electronic Scale.,http://www.argos.co.uk/static/Product/partNumber/3924169.htm,1271,1,1,96
70530,70530,Tefal Prelude Kettle,http://www.lakeland.co.uk/70530/,944,4558888,3045386371778,Tefal Prelude Stainless Steel Kettle,http://www.argos.co.uk/product/4558888,1271,1,1,90
24685,24685,Shark Rechargeable Cordless Sweep Deluxe,http://www.lakeland.co.uk/24685/,944,3075056,0622356214469,Shark V3900 Cordless Floor Sweeper.,http://www.argos.co.uk/static/Product/partNumber/3075056.htm,1271,1,1,85
25964,25964,Shark Cordless Duo Clean Hand Stick,http://www.lakeland.co.uk/25964/,944,7247938-new,622356223584,Shark DuoClean Cordless Stick Vacuum Cleaner,https://www.argos.co.uk/product/7247938,1271,1,1,78
52763,52763,Kilner 5L Drinks Dispenser,http://www.lakeland.co.uk/52763/,944,4366537,5010853202099,Kilner 5 Litre Drinks Dispenser,http://www.argos.co.uk/product/4366537,1271,1,1,100
71308,71308,Nutri Ninja Compact System with Auto IQ,http://www.lakeland.co.uk/71308/,944,4085746,0622356214995,Ninja BL490UK Compact Kitchen System with Nutri Ninja,http://www.argos.co.uk/product/4085746,1271,1,1,
25025,25025,Morphy Richards Redefine Atomist Iron,http://www.lakeland.co.uk/25025/,944,5497656,5011832047489,Morphy Richards 360001 Redefine Atomist Vapour Glass Iron,http://www.argos.co.uk/product/5497656,1271,1,1,89
70528,70528,Kenwood Prospero,http://www.lakeland.co.uk/70528/,944,4020677,5011423184616,Kenwood KM240 Prospero Stand Mixer - Stainless Steel,https://www.argos.co.uk/product/4020677,1271,1,1,82
24954,24954,dyson dc34 handheld cordless vacuum,http://www.lakeland.co.uk/24954/,944,4066813,5025155011355,Dyson DC34 Handheld Vacuum Cleaner.,http://www.argos.co.uk/static/Product/partNumber/4066813.htm,1271,1,1,94
44867,44867,Spinning Party Bulb,http://www.lakeland.co.uk/44867/,944,4049359,5060359484666,Pretty Pink Party Disco Bulb,https://www.argos.co.uk/product/4049359,1271,1,0,71
31762,31762,Morphy Richards Soup and Milk Maker,http://www.lakeland.co.uk/31762/,944,5639328,5011832053152,Morphy Richards Soya Milk and Soup Maker,http://www.argos.co.uk/product/5639328,1271,1,1,96
70531,70531,Tefal Prelude 2 Slice Toaster,http://www.lakeland.co.uk/70531/,944,4552406,3045385783282,Tefal Prelude Stainless Steel 2 Slice Toaster,http://www.argos.co.uk/product/4552406,1271,1,1,94
70350,70350,Dualit Milk Frother,http://www.lakeland.co.uk/70350/,944,2274652,619743841452,Dualit 84135 Milk Frother - Black,https://www.argos.co.uk/product/2274652,1271,1,1,93
24944,24944,BRABANTIA FLIP BIN 30L WHITE,http://www.lakeland.co.uk/24944/,944,4086549,8710755106866,Brabantia 30 Litre Flip Lid Kitchen Bin - White,http://www.argos.co.uk/product/4086549,1271,1,1,96
17319,17319,VINTAGE KITCHEN RED BREAD BIN M/O,http://www.lakeland.co.uk/17319/,944,2572756,5027899390567,Typhoon Vintage Kitchen Bread Bin - Red,http://www.argos.co.uk/product/2572756,1271,1,1,
17299,17299,VINTAGE KITCHEN RED SCALES M/O,http://www.lakeland.co.uk/17299/,944,2666291,5027899300665,Typhoon Vintage Kitchen Scales - Red,http://www.argos.co.uk/product/2666291,1271,1,1,89
25555,25555,JJ 24L STACK BIN STONE,http://www.lakeland.co.uk/25555/,944,6077484,5028420300130,Joseph Joseph 24 Litre Stack Recycling Bin - Stone,http://www.argos.co.uk/product/6077484,1271,1,1,91
24937,24937,BRABANTIA TOUCH BIN 30L BRILLIANT STEEL,http://www.lakeland.co.uk/24937/,944,4116220,8710755338229,Brabantia 30 Litre Touch Lid Kitchen Bin - Brilliant Steel,http://www.argos.co.uk/product/4116220,1271,1,1,100
16226,16226,3 Kilner Preserving Jars 1 Litre,http://www.lakeland.co.uk/16226/,944,4395591,5010853172781,Kilner 1 Litre Preserve Jars - Set of 3,http://www.argos.co.uk/product/4395591,1271,1,1,
31688,31688,Tefal Actifry Smart XL,http://www.lakeland.co.uk/31688/,944,7158223,3045380010888,Tefal AH980840 ActiFry Smart XL Bluetooth 1.7kg Air Fryer,https://www.argos.co.uk/product/7158223,1271,1,1,73
31770,31770,Kenwood kMix Hand Mixer White,http://www.lakeland.co.uk/31770/,944,4289827,5011423121697,Kenwood KMix HM790 Hand Mixer - White,http://www.argos.co.uk/product/4289827,1271,1,1,97
